{
  "contract": "kernel_output",
  "version": "v1",
  "output_id": "kernel_output:kin_0001-observed_state",
  "kernel_type": "observed_state",
  "input_id": "kin_0001",
  "status": "success",
  "judgment": "observed_state_partial",
  "confidence": 0.4,
  "reasons": [
    "Three observations were made, but the revenue model and operating mode are clear while customer validation is not.",
    "The evidence supports a partial observed state judgment."
  ],
  "evidence_used": [
    "ev_001",
    "ev_002",
    "ev_003"
  ],
  "metadata": {
    "object_id": "kernel_output:kin_0001-observed_state",
    "schema_version": "v1",
    "created_at": "2026-03-14T12:30:00Z",
    "updated_at": "2026-03-14T12:30:00Z",
    "source_system": "jigsaw",
    "pipeline_run_id": "kernel-lmstudio-observed-test",
    "confidence": 0.4,
    "tags": [
      "kernel-lane",
      "observed-state",
      "lmstudio"
    ],
    "lineage": [
      "kin_0001"
    ]
  }
}