{
  "contract": "kernel_output",
  "version": "v1",
  "output_id": "kernel_output:kin_0001-contradiction",
  "kernel_type": "contradiction",
  "input_id": "kin_0001",
  "status": "success",
  "judgment": "contradiction_detected",
  "confidence": 0.81,
  "reasons": [
    "customer_validation is observed as False but claimed as True."
  ],
  "evidence_used": [
    "ev_001",
    "ev_002",
    "ev_003"
  ],
  "metadata": {
    "object_id": "kernel_output:kin_0001-contradiction",
    "schema_version": "v1",
    "created_at": "2026-03-15T00:30:00Z",
    "updated_at": "2026-03-15T00:30:00Z",
    "source_system": "jigsaw",
    "pipeline_run_id": "kernel-lmstudio-expected-test",
    "confidence": 0.81,
    "tags": [
      "kernel-lane",
      "contradiction"
    ],
    "lineage": [
      "kin_0001"
    ]
  }
}