{
  "contract": "kernel_output",
  "version": "v1",
  "output_id": "kernel_output:kin_0001-expected_state",
  "kernel_type": "expected_state",
  "input_id": "kin_0001",
  "status": "success",
  "judgment": "expected_state_partial",
  "confidence": 0.75,
  "reasons": [
    "The revenue model is documented and appears viable, which aligns with the expected state.",
    "Customer validation has not been achieved according to field notes, but there's an internal claim suggesting it is present. This creates a conflict that prevents full alignment."
  ],
  "evidence_used": [
    "ev_001",
    "ev_002",
    "ev_003"
  ],
  "metadata": {
    "object_id": "kernel_output:kin_0001-expected_state",
    "schema_version": "v1",
    "created_at": "2026-03-15T09:30:00Z",
    "updated_at": "2026-03-15T09:30:00Z",
    "source_system": "jigsaw",
    "pipeline_run_id": "kernel-lmstudio-mixed-test",
    "confidence": 0.75,
    "tags": [
      "kernel-lane",
      "expected-state",
      "lmstudio"
    ],
    "lineage": [
      "kin_0001"
    ]
  }
}