{
  "contract": "kernel_output",
  "version": "v1",
  "output_id": "kernel_output:kin_gc_45-contradiction",
  "kernel_type": "contradiction",
  "input_id": "kin_gc_45",
  "status": "success",
  "judgment": "contradiction_not_detected",
  "confidence": 0.72,
  "reasons": [
    "No material contradiction detected across the provided input set."
  ],
  "evidence_used": [
    "gc_ev_45",
    "gc_ev_8",
    "gc_ev_22",
    "gc_ev_14"
  ],
  "metadata": {
    "object_id": "kernel_output:kin_gc_45-contradiction",
    "schema_version": "v1",
    "created_at": "2026-03-15T11:45:00Z",
    "updated_at": "2026-03-15T11:45:00Z",
    "source_system": "jigsaw",
    "pipeline_run_id": "real-case-remote-workflow",
    "confidence": 0.72,
    "tags": [
      "kernel-lane",
      "contradiction"
    ],
    "lineage": [
      "kin_gc_45"
    ]
  }
}