{
  "contract": "kernel_output",
  "version": "v1",
  "output_id": "kernel_output:kin_0001-observed_state",
  "kernel_type": "observed_state",
  "input_id": "kin_0001",
  "status": "success",
  "judgment": "observed_state_partial",
  "confidence": 0.7,
  "reasons": [
    "The observed items include three key aspects: revenue model, customer validation, and operating mode.",
    "There are four expected observations mentioned in the normalization context, but only three have been provided so far.",
    "One of the observations is about a viable revenue model which has strong evidence with confidence 0.86.",
    "Another observation concerns customer validation; it's explicitly stated as false by one source (ev_002) but contradicted by an internal claim (ev_003).",
    "The third observation indicates the operating mode is remote, supported by moderate confidence."
  ],
  "evidence_used": [
    "ev_001",
    "ev_002",
    "ev_003"
  ],
  "metadata": {
    "object_id": "kernel_output:kin_0001-observed_state",
    "schema_version": "v1",
    "created_at": "2026-03-14T12:30:00Z",
    "updated_at": "2026-03-14T12:30:00Z",
    "source_system": "jigsaw",
    "pipeline_run_id": "kernel-lmstudio-observed-test",
    "confidence": 0.7,
    "tags": [
      "kernel-lane",
      "observed-state",
      "lmstudio"
    ],
    "lineage": [
      "kin_0001"
    ]
  }
}