{
  "contract": "kernel_output",
  "version": "v1",
  "output_id": "kernel_output:kin_0001-expected_state",
  "kernel_type": "expected_state",
  "input_id": "kin_0001",
  "status": "success",
  "judgment": "expected_state_partial",
  "confidence": 0.7833,
  "reasons": [
    "customer_validation is not aligned with the expected target."
  ],
  "evidence_used": [
    "ev_001",
    "ev_002",
    "ev_003"
  ],
  "metadata": {
    "object_id": "kernel_output:kin_0001-expected_state",
    "schema_version": "v1",
    "created_at": "2026-03-14T12:00:00Z",
    "updated_at": "2026-03-14T12:00:00Z",
    "source_system": "jigsaw",
    "pipeline_run_id": "kernel-lane-first-bundle",
    "confidence": 0.7833,
    "tags": [
      "kernel-lane",
      "expected-state"
    ],
    "lineage": [
      "kin_0001"
    ]
  }
}