{
  "contract": "kernel_output",
  "version": "v1",
  "output_id": "kernel_output:kin_0001-expected_state",
  "kernel_type": "expected_state",
  "input_id": "kin_0001",
  "status": "success",
  "judgment": "expected_state_partial",
  "confidence": 0.75,
  "reasons": [
    "The revenue model is documented and appears viable, which aligns with the expected value for that pair.",
    "Customer validation has conflicting evidence: field notes indicate it's not achieved (aligned false), but an internal claim states it is present (which may be incorrect).",
    "Operating mode matches exactly as remote."
  ],
  "evidence_used": [
    "ev_001",
    "ev_002",
    "ev_003"
  ],
  "metadata": {
    "object_id": "kernel_output:kin_0001-expected_state",
    "schema_version": "v1",
    "created_at": "2026-03-15T00:30:00Z",
    "updated_at": "2026-03-15T00:30:00Z",
    "source_system": "jigsaw",
    "pipeline_run_id": "kernel-lmstudio-expected-test",
    "confidence": 0.75,
    "tags": [
      "kernel-lane",
      "expected-state",
      "lmstudio"
    ],
    "lineage": [
      "kin_0001"
    ]
  }
}